{"actions": [{"action_type": "openUrl", "label": "View on Netflix", "required": true, "target": "https://www.netflix.com/"}, {"action_type": "openUrl", "label": "Compare reviews", "required": true, "target": "https://www.rottentomatoes.com/"}], "code_blocks": [], "content_units": ["Best Fits for Witty, Low-Cruelty Comedy", "For a viewer who wants   smart storytelling   and wants to avoid   cruelty, mean-spiritedness, and heavy shock humor  , the strongest matches are   Mike Birbiglia: The New One  ,   John Mulaney: Kid Gorgeous  , and   Hasan Minhaj: Homecoming King  .", "The biggest wildcard is   Bo Burnham: Inside  —brilliant and inventive, but much darker and more emotionally abrasive than the others.", "Ranked Specials for This Taste", "Rank   Special   Style   Emotional Tone   Likely Dealbreakers", "1     Mike Birbiglia: The New One     Intimate narrative storytelling; polished long-form personal comedy   Warm, reflective, humane   Less punchline-dense; more theatrical and parental/relationship-focused", "2     John Mulaney: Kid Gorgeous     Precise, witty observational storytelling with elegant phrasing   Light, playful, polished   Some edgier bits and Catholic/family material, but rarely cruel", "3     Hasan Minhaj: Homecoming King     High-energy personal storytelling with social commentary   Earnest, funny, emotionally sincere   Includes racism, rejection, and identity pain; more intense than cozy", "4     Taylor Tomlinson: Look At You     Sharp confessional stand-up; structured personal material   Candid, vulnerable, upbeat-dark   Strong mental health/religious material; more bite and rawness than top 3", "5     Ali Wong: Baby Cobra     Bold, aggressive personal storytelling; physical and blunt   Brash, mischievous, unapologetic   Heavy sexual content; intentionally shocking delivery can be too abrasive", "6     Bo Burnham: Inside     Experimental musical storytelling; satirical performance art   Dark, anxious, isolating   Intense despair, abrasive satire, and discomfort-first humor", "1) Mike Birbiglia: The New One", "-   Why it ranks highest:   It is probably the cleanest match for “witty storytelling” with minimal cruelty.", "-   Style:   Birbiglia builds a full narrative arc rather than stacking disconnected jokes. It feels closer to a one-man story show than a traditional stand-up set.", "-   Emotional tone:   Gentle, thoughtful, affectionate, and introspective.", "-   Likely dealbreakers:   If you want rapid-fire laughs or a more energetic stage presence, it may feel understated.", "2) John Mulaney: Kid Gorgeous", "-   Why it fits well:   Mulaney is one of the best pure joke writers here, and his storytelling is clever without feeling mean.", "-   Style:   Polished anecdotal stand-up, elegant wording, memorable act-outs, and clean structure.", "-   Emotional tone:   Bright, theatrical, charming.", "-   Likely dealbreakers:   Less emotionally deep than Birbiglia or Minhaj; if you want vulnerability first, this is more crafted than intimate.", "3) Hasan Minhaj: Homecoming King", "-   Why it fits:   Strong story architecture and emotional payoff make it excellent for viewers who like comedy with a narrative spine.", "-   Style:   TED-talk-like visual storytelling mixed with stand-up rhythm and personal history.", "-   Emotional tone:   Passionate, personal, heartfelt, occasionally righteous.", "-   Likely dealbreakers:   It deals directly with discrimination and humiliation, so while it is not cruel in spirit, some stories hit painful notes.", "4) Taylor Tomlinson: Look At You", "-   Why it’s mid-pack:   Very smart and personable, with strong self-aware storytelling.", "-   Style:   Modern confessional stand-up—tight jokes built around mental health, faith, family, and adulthood.", "-   Emotional tone:   Vulnerable, brisk, dry, emotionally honest.", "-   Likely dealbreakers:   More edge and emotional volatility than Mulaney; some viewers may find the self-analysis heavier than “comfort comedy.”", "5) Ali Wong: Baby Cobra", "-   Why it ranks lower for this preference:   It is undeniably strong storytelling, but much more confrontational and shock-forward.", "-   Style:   Swaggering, physical, intimate, highly provocative personal comedy.", "-   Emotional tone:   Bold, irreverent, gleefully excessive.", "-   Likely dealbreakers:   Explicit sexual material and aggressive punchlines are central to the special, not occasional.", "6) Bo Burnham: Inside", "-   Why it ranks last for this viewer:   It is brilliant, but least aligned with “witty storytelling without cruelty/shock.”", "-   Style:   Hybrid of music, monologue, visual satire, and self-conscious performance art.", "-   Emotional tone:   Claustrophobic, darkly funny, depressive, intellectually sharp.", "-   Likely dealbreakers:   The special leans into discomfort, despair, and abrasive irony; even when not cruel, it can feel emotionally punishing.", "Best Match by Viewing Mood", "Option 1:   Safest recommendation — Mike Birbiglia: The New One     Best blend of wit, humanity, and narrative craft   Lowest risk for cruelty/shock mismatch", "Option 2:   Funniest clean fit — John Mulaney: Kid Gorgeous     Most reliably light and quotable   Best if you want polished laughs first", "Option 3:   Most moving story-driven pick — Hasan Minhaj: Homecoming King     Strong emotional arc with real heart   Best if sincerity is a plus", "Option 4:   Smart but darker alternative — Taylor Tomlinson: Look At You     Excellent writing with more vulnerability and sting   Best if emotional candor appeals", "Quick Actions", "View on Netflix", "Compare reviews", "Sources", "- Netflix title library: < >", "- Rotten Tomatoes specials pages/search: < >", "- IMDb title listings: < >"], "contract_version": "1.0.0", "exact_values": ["1", "1", "1", "1.11", "1.11", "1.11", "1.11", "1.11", "1.11", "2", "2", "2", "3", "3", "3", "3", "3", "3", "3", "3", "3", "3", "4", "4", "4", "5", "5", "6", "6"], "expected_role_counts": {"action": 3, "audio": 0, "chart": 0, "code": 0, "console": 0, "email": 0, "formula": 0, "image": 0, "table": 1, "video": 0}, "extractor_version": "1.0.0", "headings": ["Best Fits for Witty, Low-Cruelty Comedy", "Ranked Specials for This Taste", "1) Mike Birbiglia: The New One", "2) John Mulaney: Kid Gorgeous", "3) Hasan Minhaj: Homecoming King", "4) Taylor Tomlinson: Look At You", "5) Ali Wong: Baby Cobra", "6) Bo Burnham: Inside", "Best Match by Viewing Mood", "Quick Actions", "Sources"], "inline_code": [], "intent": "entertainment", "media": [{"kind": "Icon", "required": true, "url": "https://cdn.jsdelivr.net/npm/bootstrap-icons@1.11.3/icons/music-note.svg"}, {"kind": "Icon", "required": true, "url": "https://cdn.jsdelivr.net/npm/bootstrap-icons@1.11.3/icons/star.svg"}, {"kind": "Icon", "required": true, "url": "https://cdn.jsdelivr.net/npm/bootstrap-icons@1.11.3/icons/house.svg"}, {"kind": "Icon", "required": true, "url": "https://cdn.jsdelivr.net/npm/bootstrap-icons@1.11.3/icons/moon-stars.svg"}, {"kind": "Icon", "required": true, "url": "https://cdn.jsdelivr.net/npm/bootstrap-icons@1.11.3/icons/lightning.svg"}, {"kind": "Icon", "required": true, "url": "https://cdn.jsdelivr.net/npm/bootstrap-icons@1.11.3/icons/camera-video.svg"}], "required_roles": {"action": true, "audio": false, "chart": false, "code": false, "console": false, "email": false, "formula": false, "image": false, "table": true, "video": false}, "source_hash": "59723ce0ce08fb15d820235175ddf3ae2092bcbf95be9ec3fd4e66a23cfbb51e", "source_links": [{"url": "https://www.imdb.com/"}], "tables": [{"headers": ["Rank", "Special", "Style", "Emotional Tone", "Likely Dealbreakers"], "required": true, "rows": [["1", "Mike Birbiglia: The New One", "Intimate narrative storytelling; polished long-form personal comedy", "Warm, reflective, humane", "Less punchline-dense; more theatrical and parental/relationship-focused"], ["2", "John Mulaney: Kid Gorgeous", "Precise, witty observational storytelling with elegant phrasing", "Light, playful, polished", "Some edgier bits and Catholic/family material, but rarely cruel"], ["3", "Hasan Minhaj: Homecoming King", "High-energy personal storytelling with social commentary", "Earnest, funny, emotionally sincere", "Includes racism, rejection, and identity pain; more intense than cozy"], ["4", "Taylor Tomlinson: Look At You", "Sharp confessional stand-up; structured personal material", "Candid, vulnerable, upbeat-dark", "Strong mental health/religious material; more bite and rawness than top 3"], ["5", "Ali Wong: Baby Cobra", "Bold, aggressive personal storytelling; physical and blunt", "Brash, mischievous, unapologetic", "Heavy sexual content; intentionally shocking delivery can be too abrasive"], ["6", "Bo Burnham: Inside", "Experimental musical storytelling; satirical performance art", "Dark, anxious, isolating", "Intense despair, abrasive satire, and discomfort-first humor"]]}]}