{"actions": [{"action_type": "openUrl", "label": "Compare fit", "required": true, "target": "https://www.consumerreports.org/electronics-computers/streaming-media/how-to-choose-a-streaming-service-a1756978028"}, {"action_type": "openUrl", "label": "Pick GalaxyPlay", "required": true, "target": "https://www.justwatch.com/"}, {"action_type": "openUrl", "label": "Review family options", "required": true, "target": "https://www.commonsensemedia.org/"}], "code_blocks": [], "content_units": ["Best 2-Subscription Fit for Your Household", "Within your   USD 24/month   cap and   4+ total screens   requirement, the strongest pairing is   GalaxyPlay + VaultPlus   for   USD 27/month   if you can stretch slightly, but since that breaks budget, the best fully compliant choice is   GalaxyPlay + ToonTrail   at   USD 22/month  .", "Combination Comparison Table", "Combination   Monthly Cost   Total Screens   Family Content   Sci‑fi Fit   Docs / International Fit   Verdict", "GalaxyPlay + ToonTrail   USD 22   6   Excellent   Strong   Limited     Best within budget", "GalaxyPlay + CineNest   USD 24   6   Good   Strong   Strong international   Great balance, weaker kids depth", "CineNest + VaultPlus   USD 25   5   Fair   Weak   Excellent   Strong adult taste match, over budget", "GalaxyPlay + VaultPlus   USD 27   7   Strong   Strong   Excellent docs   Best overall mix, over budget", "AllRounder + ToonTrail   USD 25   6   Strong   Good   Okay   Simple but over budget", "AllRounder + TrueCase   USD 23   5   Fair   Okay   Fair docs   Meets rules, weaker for child", "Recommended Pairing: GalaxyPlay + ToonTrail", "Why this is the best fit:", "-   Meets budget:   USD 22/month.", "-   Exceeds screen requirement:     6 total screens  .", "-   Best for your child and family movie nights:   GalaxyPlay has a   strong family section  , and ToonTrail is built around   animation and family movies  .", "-   Covers the sci-fi fan well:   GalaxyPlay is the strongest sci-fi/fantasy option in the list.", "-   Avoids weak overlap:   These two services complement each other instead of doubling down on the same niche.", "Trade-off:", "- This combo is not ideal for the adult who prefers   documentaries and international films  . ToonTrail adds little for that viewer.", "Strong Alternative: GalaxyPlay + CineNest", "Option 1:   GalaxyPlay + CineNest     Best balanced budget-max choice for all three household members     USD 24/month, 6 screens", "Compare fit", "Why it may be better if adult balance matters more than kid depth:", "-   GalaxyPlay   handles   sci-fi  , franchise viewing, and family-friendly watching.", "-   CineNest   adds   prestige drama   and   international films  , directly matching one adult’s taste.", "- Still stays exactly at your   budget cap   and gives   6 screens total  .", "Why it ranks just behind the top pick:", "-   Kids content is more limited   on CineNest than on ToonTrail.", "- Since you watch   family films twice a week  , ToonTrail contributes more directly to your most frequent use case.", "Decision Guidance", "If your top priority order is:", "-   Family viewing + sci-fi + budget compliance   → choose   GalaxyPlay + ToonTrail", "-   Balanced satisfaction for both adults + still family-capable   → choose   GalaxyPlay + CineNest", "My final recommendation:   GalaxyPlay + ToonTrail  .", "Quick Actions", "Pick GalaxyPlay", "Review family options", "Planning Notes", "Using the stated constraints, I prioritized in this order:", "- Stay at or under   USD 24/month", "- Reach   at least 4 simultaneous screens", "- Support   family films twice weekly", "- Cover   sci-fi", "- Then maximize   documentary/international   depth within what remains possible", "Sources", "- JustWatch streaming guide: < >", "- Common Sense Media family viewing guidance: < >", "- Consumer Reports streaming service advice: < >"], "contract_version": "1.0.0", "exact_values": ["1", "1.11", "2", "22", "22", "22", "23", "24", "24", "24", "24", "25", "25", "27", "27", "3", "4", "4", "5", "5", "6", "6", "6", "6", "6", "6", "7"], "expected_role_counts": {"action": 3, "audio": 0, "chart": 0, "code": 0, "console": 0, "email": 0, "formula": 0, "image": 0, "table": 1, "video": 0}, "extractor_version": "1.0.0", "headings": ["Best 2-Subscription Fit for Your Household", "Combination Comparison Table", "Recommended Pairing: GalaxyPlay + ToonTrail", "Strong Alternative: GalaxyPlay + CineNest", "Decision Guidance", "Quick Actions", "Planning Notes", "Sources"], "inline_code": [], "intent": "entertainment", "media": [{"kind": "Icon", "required": true, "url": "https://cdn.jsdelivr.net/npm/bootstrap-icons@1.11.3/icons/tv.svg"}], "required_roles": {"action": true, "audio": false, "chart": false, "code": false, "console": false, "email": false, "formula": false, "image": false, "table": true, "video": false}, "source_hash": "b4b32c066efb19eb79a03319c28e39dd7424cad5b190f38c97c6a447d6f664c8", "source_links": [], "tables": [{"headers": ["Combination", "Monthly Cost", "Total Screens", "Family Content", "Sci‑fi Fit", "Docs / International Fit", "Verdict"], "required": true, "rows": [["GalaxyPlay + ToonTrail", "USD 22", "6", "Excellent", "Strong", "Limited", "Best within budget"], ["GalaxyPlay + CineNest", "USD 24", "6", "Good", "Strong", "Strong international", "Great balance, weaker kids depth"], ["CineNest + VaultPlus", "USD 25", "5", "Fair", "Weak", "Excellent", "Strong adult taste match, over budget"], ["GalaxyPlay + VaultPlus", "USD 27", "7", "Strong", "Strong", "Excellent docs", "Best overall mix, over budget"], ["AllRounder + ToonTrail", "USD 25", "6", "Strong", "Good", "Okay", "Simple but over budget"], ["AllRounder + TrueCase", "USD 23", "5", "Fair", "Okay", "Fair docs", "Meets rules, weaker for child"]]}]}