{"actions": [{"action_type": "openUrl", "label": "Open Spotify", "required": true, "target": "https://open.spotify.com/"}, {"action_type": "openUrl", "label": "Open YouTube Music", "required": true, "target": "https://music.youtube.com/"}], "code_blocks": [], "content_units": ["3-Hour Drive Playlist Overview", "A 12-song sequence built for motion and variety: quick-energy openers, a relaxed center stretch, and a bright final lift.", "It mixes   pop, indie, and classic rock  , keeps lyrics broadly   clean/radio-safe  , includes   4+ women artists  , and avoids overloading any single decade.", "12-Song Road-Trip Sequence", "1.   Go Your Own Way — Fleetwood Mac", "- Decade: 1970s", "- Why here: Immediate momentum, familiar hook, and classic-rock drive to get the trip rolling.", "2.   Shut Up and Dance — WALK THE MOON", "- Decade: 2010s", "- Why here: Keeps the pulse high with punchy pop-rock energy and singalong appeal.", "3.   Dog Days Are Over — Florence + The Machine", "- Decade: 2000s", "- Women artist", "- Why here: Big, galloping release that expands the opening burst without feeling repetitive.", "4.   Dancing with Myself — Billy Idol", "- Decade: 1980s", "- Why here: Still upbeat, but slightly leaner and more rhythmic—good bridge out of the opening sprint.", "5.   Dreams — The Cranberries", "- Decade: 1990s", "- Women artist", "- Why here: This is where the playlist starts exhaling; bright indie-pop shimmer without dropping too hard.", "6.   Put Your Records On — Corinne Bailey Rae", "- Decade: 2000s", "- Women artist", "- Why here: Warm, breezy, windows-down middle section; mellow but not sleepy.", "7.   Riptide — Vance Joy", "- Decade: 2010s", "- Why here: Acoustic, easygoing, and road-friendly; it keeps the center light and relaxed.", "8.   Fast Car — Tracy Chapman", "- Decade: 1980s", "- Women artist", "- Why here: The emotional heart of the set—reflective and steady for the deepest mellow point.", "9.   Here Comes the Sun — The Beatles", "- Decade: 1960s", "- Why here: Gently turns the mood upward and signals the transition into the home stretch.", "10.   Walking on Sunshine — Katrina and the Waves", "- Decade: 1980s", "- Women artist", "- Why here: Bright, unmistakable lift; this is the clearest “we’re coming back up” moment.", "11.   Mr. Blue Sky — Electric Light Orchestra", "- Decade: 1970s", "- Why here: Expansive, joyful, and perfect for the final scenic stretch of the drive.", "12.   Levitating — Dua Lipa", "- Decade: 2020s", "- Women artist", "- Why here: Modern, polished, and celebratory—an uplifting finish that lands the playlist with bounce.", "Flow by Drive Phase", "Energetic start (Tracks 1–4)", "- Starts with classic-rock motion, then shifts into pop and alt energy.", "- The first third is built to feel like pulling onto open road with confidence.", "Mellow middle (Tracks 5–8)", "- The center softens into breezy indie and reflective singer-songwriter territory.", "- It gives your ears a reset without losing cohesion.", "Uplifting finish (Tracks 9–12)", "- The last stretch gradually brightens, then finishes on two undeniable mood-boosters.", "- It should feel optimistic rather than abrupt.", "Fit Check", "- Genres covered:   pop, indie, classic rock", "- Women artists:   Florence + The Machine, The Cranberries, Corinne Bailey Rae, Tracy Chapman, Katrina and the Waves, Dua Lipa", "- Decade balance:", "- 1960s: 1", "- 1970s: 2", "- 1980s: 2", "- 1990s: 1", "- 2000s: 2", "- 2010s: 2", "- 2020s: 1", "- Explicit lyrics:   avoided", "Quick Actions", "Open Spotify", "Open YouTube Music"], "contract_version": "1.0.0", "exact_values": ["1", "1", "1", "1", "1", "1.11", "10", "11", "12", "12", "12", "12", "2", "2", "2", "2", "2", "3", "3", "3", "4", "4", "4", "5", "5", "6", "7", "8", "8", "9", "9"], "expected_role_counts": {"action": 2, "audio": 0, "chart": 0, "code": 0, "console": 0, "email": 0, "formula": 0, "image": 0, "table": 0, "video": 0}, "extractor_version": "1.0.0", "headings": ["3-Hour Drive Playlist Overview", "12-Song Road-Trip Sequence", "Flow by Drive Phase", "Fit Check", "Quick Actions"], "inline_code": [], "intent": "entertainment", "media": [{"kind": "Icon", "required": true, "url": "https://cdn.jsdelivr.net/npm/bootstrap-icons@1.11.3/icons/music-note-beamed.svg"}], "required_roles": {"action": true, "audio": false, "chart": false, "code": false, "console": false, "email": false, "formula": false, "image": false, "table": false, "video": false}, "source_hash": "47a75b21327e98be1720a4cea15b600d17faa688d725ed465760dd53c771e339", "source_links": [], "tables": []}