{"actions": [{"action_type": "openUrl", "label": "Make a Shortlist", "required": true, "target": "https://letterboxd.com/"}, {"action_type": "openUrl", "label": "Save Watch Order", "required": true, "target": "https://www.imdb.com/list/create"}], "code_blocks": [], "content_units": ["Movie Night Fit for Your Group", "Here’s a suspense-first lineup of 8 sci-fi and mystery films that fit your constraints:   2005–2023  ,   under 130 minutes  ,   low on sexual content  , and generally   more tense than graphic  . I’ve also ordered them from   lightest to most intense   so you can pick based on the room’s mood.", "Ranked Picks: Lightest to Most Intense", "Order   Film   Year   Runtime   Genre   Why it fits", "1     Enola Holmes     2020   123 min   Mystery   Fast, clever, family-friendly detective fun with light peril", "2     The Vast of Night     2019   91 min   Sci-fi mystery   Dialogue-driven small-town UFO mystery with almost no graphic content", "3     Source Code     2011   93 min   Sci-fi thriller   Tense and smart, with action but little gore or sexual content", "4     Searching     2018   102 min   Mystery thriller   Gripping missing-person mystery told through screens, intense but clean", "5     Missing     2023   111 min   Mystery thriller   Similar screenlife suspense, a bit twistier and more stressful", "6     10 Cloverfield Lane     2016   103 min   Sci-fi thriller   Claustrophobic and suspenseful with limited but stronger violence", "7     Coherence     2013   89 min   Sci-fi mystery   Talky, brainy dinner-party paranoia that gets increasingly unsettling", "8     The Invisible Man     2020   124 min   Sci-fi thriller   Excellent suspense, but the most intense pick due to stalking and violence themes", "The 8 Best Options", "Option 1:   Enola Holmes     A bright, quick-moving mystery led by Sherlock Holmes’s teenage sister as she outsmarts adults and follows clues across London.     Ages 13+ friendly", "- Hook: A witty young detective races through disguises, codes, and conspiracies to solve a disappearance before anyone can stop her.", "- Content cautions: Mild action peril, brief violence, some thematic danger; essentially no sexual content.", "- Best for: Mixed-age group, lighter start, mystery over menace.", "Option 2:   The Vast of Night     A retro small-town sci-fi mystery that builds tension almost entirely through sound, conversation, and atmosphere.     Ages 13+ friendly", "- Hook: One strange phone call and a mysterious audio frequency pull two teens into an eerie overnight investigation.", "- Content cautions: Creepy mood, some anxiety-producing suspense, little to no gore, no meaningful sexual content.", "- Best for: Quiet crowd, slow-burn fans, PG-13-style tension.", "Option 3:   Source Code     A sharp sci-fi thriller with a mystery structure and a very efficient runtime.     Ages 13+ for many teens", "- Hook: A man repeatedly relives the same train bombing to identify the attacker before another disaster hits.", "- Content cautions: Explosion-related peril, some deaths, moderate action intensity; minimal sexual content.", "- Best for: Group that wants momentum, puzzle-solving, and suspense without gore.", "Option 4:   Searching     A modern mystery that turns a missing-person case into a tight digital thriller.   Teen-friendly for many, but more emotionally intense", "- Hook: A father digs through messages, accounts, and hidden online lives to find his missing daughter.", "- Content cautions: Distressing themes involving disappearance, emotional tension, brief strong language; no sexual content focus.", "- Best for: Crowd that likes twists and realistic suspense.", "Option 5:   Missing     A more frantic, twist-heavy follow-up in spirit to  Searching , with strong crowd-pleasing momentum.   Teen-capable, but stress level is higher", "- Hook: When her mother vanishes overseas, a daughter uses every digital tool she can find to uncover a larger deception.", "- Content cautions: Kidnapping/peril themes, sustained tension, some violence references; no notable sexual content.", "- Best for: Fast-paced mystery night with lots of reveals.", "Option 6:   10 Cloverfield Lane     A compact containment thriller with strong performances and constant uncertainty.   Best for older teens/adults", "- Hook: After a crash, a woman wakes in an underground bunker and must decide whether her captor is lying or saving her life.", "- Content cautions: Psychological menace, controlling behavior, bursts of violence, disturbing tension; minimal sexual content.", "- Best for: Suspense lovers who want pressure-cooker intensity.", "Option 7:   Coherence     A low-budget but highly effective mind-bender that gets better if your group likes post-movie discussion.   Best for adults/older teens", "- Hook: During a comet pass, a dinner party slips into a reality-bending mystery where nobody can be fully trusted.", "- Content cautions: Anxiety, arguments, paranoia, some violence; no significant sexual content.", "- Best for: Smart, conversation-heavy sci-fi mystery.", "Option 8:   The Invisible Man     The most intense recommendation here, but also one of the strongest suspense films of the bunch.   Adults or mature older teens", "- Hook: A woman convinced she is being hunted by an unseen abuser must prove the impossible while staying alive.", "- Content cautions: Domestic abuse/stalking themes, strong sustained threat, violence, frightening sequences; little sexual content.", "- Best for: Group that wants maximum tension without heavy gore.", "Best Viewing Order for Your Night", "If you want a full progression from easiest watch to highest intensity, use this order:", "1.   Enola Holmes", "2.   The Vast of Night", "3.   Source Code", "4.   Searching", "5.   Missing", "6.   10 Cloverfield Lane", "7.   Coherence", "8.   The Invisible Man", "If you’re only picking   two   for one evening:", "-   Safest crowd-pleaser pair:    Enola Holmes  +  Source Code", "-   Best mystery-heavy pair:    Searching  +  Missing", "-   Best tense sci-fi pair:    The Vast of Night  +  10 Cloverfield Lane", "Age-Safer Picks for 13+", "These are the clearest fits for your “at least 2 options for ages 13+” requirement:", "-   Enola Holmes", "-   The Vast of Night", "-   Source Code", "-   Searching   can also work for many 13+ viewers, depending on sensitivity to missing-person themes.", "Quick Actions", "Make a Shortlist", "Save Watch Order"], "contract_version": "1.0.0", "exact_values": ["1", "1", "1", "1.11", "1.11", "1.11", "1.11", "1.11", "1.11", "1.11", "1.11", "10", "10", "10", "10", "102 min", "103 min", "111 min", "123 min", "124 min", "13", "13", "13", "13", "13", "13", "13", "130 minutes", "2", "2", "2", "2", "2005", "2011", "2013", "2016", "2018", "2019", "2020", "2020", "2023", "2023", "3", "3", "3", "3", "3", "3", "3", "3", "3", "3", "3", "4", "4", "4", "5", "5", "5", "6", "6", "6", "7", "7", "7", "8", "8", "8", "8", "8", "89 min", "91 min", "93 min"], "expected_role_counts": {"action": 2, "audio": 0, "chart": 0, "code": 0, "console": 0, "email": 0, "formula": 0, "image": 0, "table": 1, "video": 0}, "extractor_version": "1.0.0", "headings": ["Movie Night Fit for Your Group", "Ranked Picks: Lightest to Most Intense", "The 8 Best Options", "Best Viewing Order for Your Night", "Age-Safer Picks for 13+", "Quick Actions"], "inline_code": [], "intent": "entertainment", "media": [{"kind": "Icon", "required": true, "url": "https://cdn.jsdelivr.net/npm/bootstrap-icons@1.11.3/icons/play-circle.svg"}, {"kind": "Icon", "required": true, "url": "https://cdn.jsdelivr.net/npm/bootstrap-icons@1.11.3/icons/music-note-beamed.svg"}, {"kind": "Icon", "required": true, "url": "https://cdn.jsdelivr.net/npm/bootstrap-icons@1.11.3/icons/cpu.svg"}, {"kind": "Icon", "required": true, "url": "https://cdn.jsdelivr.net/npm/bootstrap-icons@1.11.3/icons/laptop.svg"}, {"kind": "Icon", "required": true, "url": "https://cdn.jsdelivr.net/npm/bootstrap-icons@1.11.3/icons/phone.svg"}, {"kind": "Icon", "required": true, "url": "https://cdn.jsdelivr.net/npm/bootstrap-icons@1.11.3/icons/house.svg"}, {"kind": "Icon", "required": true, "url": "https://cdn.jsdelivr.net/npm/bootstrap-icons@1.11.3/icons/star.svg"}, {"kind": "Icon", "required": true, "url": "https://cdn.jsdelivr.net/npm/bootstrap-icons@1.11.3/icons/eye.svg"}], "required_roles": {"action": true, "audio": false, "chart": false, "code": false, "console": false, "email": false, "formula": false, "image": false, "table": true, "video": false}, "source_hash": "7abdc2ebd83699d3814424449973e3eeaa981318b7215f58410d06d09eed903d", "source_links": [], "tables": [{"headers": ["Order", "Film", "Year", "Runtime", "Genre", "Why it fits"], "required": true, "rows": [["1", "Enola Holmes", "2020", "123 min", "Mystery", "Fast, clever, family-friendly detective fun with light peril"], ["2", "The Vast of Night", "2019", "91 min", "Sci-fi mystery", "Dialogue-driven small-town UFO mystery with almost no graphic content"], ["3", "Source Code", "2011", "93 min", "Sci-fi thriller", "Tense and smart, with action but little gore or sexual content"], ["4", "Searching", "2018", "102 min", "Mystery thriller", "Gripping missing-person mystery told through screens, intense but clean"], ["5", "Missing", "2023", "111 min", "Mystery thriller", "Similar screenlife suspense, a bit twistier and more stressful"], ["6", "10 Cloverfield Lane", "2016", "103 min", "Sci-fi thriller", "Claustrophobic and suspenseful with limited but stronger violence"], ["7", "Coherence", "2013", "89 min", "Sci-fi mystery", "Talky, brainy dinner-party paranoia that gets increasingly unsettling"], ["8", "The Invisible Man", "2020", "124 min", "Sci-fi thriller", "Excellent suspense, but the most intense pick due to stalking and violence themes"]]}]}