{"actions": [{"action_type": "openUrl", "label": "Build line chart", "required": true, "target": "https://www.google.com/sheets/about"}, {"action_type": "openUrl", "label": "Build stacked chart", "required": true, "target": "https://support.microsoft.com/en-us/excel"}], "code_blocks": [], "content_units": ["Weekly Sales Performance Snapshot", "- Total sales across all rows:   $145,400", "- Best-selling segment:   North / Pro   with   $54,600", "- Strongest week overall:   2026-W03   with   $57,100", "Best Charts for This Dataset", "Chart   What it shows   Why it works best", "Multi-series line chart   Weekly sales trend by segment: North Starter, South Starter, North Pro, South Pro   Best for showing week-over-week movement and comparing momentum across all 4 groups", "Stacked column chart   Total weekly sales split by product or region   Best for showing both total weekly performance and contribution mix in each week", "Chart title suggestion:   Weekly Sales by Region and Product", "Axis labels:   X-axis = Week       Y-axis = Sales ($)", "Compact Data View", "Week   North Starter   South Starter   North Pro   South Pro   Weekly Total", "2026-W01   12,000   9,500   18,000   14,200   53,700", "2026-W02   12,800   9,100   17,600   15,100   54,600", "2026-W03   13,400   9,800   19,000   14,900   57,100", "Key Performance Insights", "-   North outperformed South every week  , driven mainly by stronger Pro sales.", "-   Pro consistently led Starter   in both regions, making it the main revenue driver.", "-   Overall sales trended upward  , rising from   $53.7k   in W01 to   $57.1k   in W03, with W03 as the peak week.", "Quick Actions", "Build line chart", "Build stacked chart", "Sources", "- CSV data provided in your prompt: < >"], "contract_version": "1.0.0", "exact_values": ["$145 400", "$53", "$54 600", "$57", "$57 100", "12 000", "12 800", "13 400", "14 200", "14 900", "15 100", "17 600", "18 000", "19 000", "2026", "2026", "2026", "2026", "4", "53 700", "54 600", "57 100", "9 100", "9 500", "9 800"], "expected_role_counts": {"action": 3, "audio": 0, "chart": 1, "code": 0, "console": 0, "email": 0, "formula": 0, "image": 0, "table": 2, "video": 0}, "extractor_version": "1.0.0", "headings": ["Weekly Sales Performance Snapshot", "Best Charts for This Dataset", "Compact Data View", "Key Performance Insights", "Quick Actions", "Sources"], "inline_code": [], "intent": "information_retrieval", "media": [], "required_roles": {"action": true, "audio": false, "chart": true, "code": false, "console": false, "email": false, "formula": false, "image": false, "table": true, "video": false}, "source_hash": "ec3ad8c5ac022f97a89ec284e2a077e65ff6ab62b85e5f699664cbc273e8ad4c", "source_links": [{"url": "https://en.wikipedia.org/wiki/Comma-separated_values"}], "tables": [{"headers": ["Chart", "What it shows", "Why it works best"], "required": true, "rows": [["Multi-series line chart", "Weekly sales trend by segment: North Starter, South Starter, North Pro, South Pro", "Best for showing week-over-week movement and comparing momentum across all 4 groups"], ["Stacked column chart", "Total weekly sales split by product or region", "Best for showing both total weekly performance and contribution mix in each week"]]}, {"headers": ["Week", "North Starter", "South Starter", "North Pro", "South Pro", "Weekly Total"], "required": true, "rows": [["2026-W01", "12,000", "9,500", "18,000", "14,200", "53,700"], ["2026-W02", "12,800", "9,100", "17,600", "15,100", "54,600"], ["2026-W03", "13,400", "9,800", "19,000", "14,900", "57,100"]]}]}