{"actions": [{"action_type": "openUrl", "label": "Listen", "required": true, "target": "https://open.spotify.com/search/Khruangbin%20Mordechai"}, {"action_type": "openUrl", "label": "Listen", "required": true, "target": "https://open.spotify.com/search/Norah%20Jones%20Come%20Away%20With%20Me"}, {"action_type": "openUrl", "label": "Listen", "required": true, "target": "https://open.spotify.com/search/Leon%20Bridges%20Coming%20Home"}, {"action_type": "openUrl", "label": "Listen", "required": true, "target": "https://open.spotify.com/search/Men%20I%20Trust%20Oncle%20Jazz"}, {"action_type": "openUrl", "label": "Listen", "required": true, "target": "https://open.spotify.com/search/Nick%20Drake%20Pink%20Moon"}, {"action_type": "openUrl", "label": "Listen", "required": true, "target": "https://open.spotify.com/search/Jordan%20Rakei%20What%20We%20Call%20Life"}, {"action_type": "openUrl", "label": "Listen", "required": true, "target": "https://open.spotify.com/search/Minnie%20Riperton%20Come%20to%20My%20Garden"}, {"action_type": "openUrl", "label": "Open all", "required": true, "target": "https://open.spotify.com/search/feel%20good%20soul%20indie%20pop%20cooking"}, {"action_type": "openUrl", "label": "More like this", "required": true, "target": "https://music.apple.com/us/search?term=warm%20soul%20indie%20pop%20cooking"}], "code_blocks": [], "content_units": ["Warm Kitchen Listening Picklist", "Seven albums that fit a solo-dinner mood: soulful, soft-grooving, melodic, and easy to live inside while you chop, stir, and plate. I prioritized warmth, flow, and low emotional friction over “important” or dramatic records.", "7 Feel-Good Albums for Cooking Alone", "Option 1:   Khruangbin — Mordechai     Mellow funk and featherlight grooves that keep the room moving without demanding attention   Best for a relaxed, swaying pace", "Listen", "Option 2:   Norah Jones — Come Away With Me     Soft jazz-pop and acoustic songwriting that makes a kitchen feel calmer and more intimate   Best for candlelight-and-simmer energy", "Listen", "Option 3:   Leon Bridges — Coming Home     Vintage-soul warmth, tidy arrangements, and an easy Sunday-evening glow   Best for soul-forward comfort", "Listen", "Option 4:   Men I Trust — Oncle Jazz     Dreamy indie pop with soft basslines and zero sharp edges   Best for quiet, late-evening cooking", "Listen", "Option 5:   Nick Drake — Pink Moon     Bare acoustic songwriting that feels gentle, focused, and unobtrusive   Best for simple meals and slower rituals", "Listen", "Option 6:   Jordan Rakei — What We Call Life     Modern soul with mellow funk undercurrents and a very human warmth   Best for slightly richer, moodier-but-still-comforting flow", "Listen", "Option 7:   Minnie Riperton — Come to My Garden     Silky, sunlit soul that feels tender and restorative rather than heavy   Best for a softer, more classic finish", "Listen", "Best Matches for Your Specific Vibe", "-   Most unfussy overall:    Mordechai  — groove-first, very easy to cook through.", "-   Most comforting singer-songwriter pick:    Come Away With Me  — warm, familiar, and never abrasive.", "-   Best indie-pop fit:    Oncle Jazz  — airy and pleasant without turning icy or sad.", "-   Best soul pick:    Coming Home  — rich but still light enough for dinner prep.", "Quick Actions", "Open all", "More like this", "Listening Context", "I leaned away from albums with abrasive production, heartbreak-heavy writing, or big emotional crashes, even when they fit the genre tags. The center of gravity here is   warm, melodic, steady, and domestic-in-a-good-way  ."], "contract_version": "1.0.0", "exact_values": ["1", "1.11", "2", "3", "3", "4", "5", "6", "7", "7"], "expected_role_counts": {"action": 9, "audio": 0, "chart": 0, "code": 0, "console": 0, "email": 0, "formula": 0, "image": 0, "table": 0, "video": 0}, "extractor_version": "1.0.0", "headings": ["Warm Kitchen Listening Picklist", "7 Feel-Good Albums for Cooking Alone", "Best Matches for Your Specific Vibe", "Quick Actions", "Listening Context"], "inline_code": [], "intent": "entertainment", "media": [{"kind": "Icon", "required": true, "url": "https://cdn.jsdelivr.net/npm/bootstrap-icons@1.11.3/icons/music-note-beamed.svg"}], "required_roles": {"action": true, "audio": false, "chart": false, "code": false, "console": false, "email": false, "formula": false, "image": false, "table": false, "video": false}, "source_hash": "42ac5dfe03a2e132a82251cdce1b99baa281e6a8b1e1d1eb47d682d85ef2df3f", "source_links": [], "tables": []}