{"actions": [{"action_type": "openUrl", "label": "Create Line Chart", "required": true, "target": "https://www.google.com/sheets/about"}, {"action_type": "openUrl", "label": "Build in Excel", "required": true, "target": "https://support.microsoft.com/excel"}], "code_blocks": [], "content_units": ["Stationery Sales Snapshot", "You have 5 months of sales for 3 product categories:   Notebooks  ,   Pens  , and   Markers  .", "The clearest story in this dataset is that   Notebooks and Markers are trending upward  , while   Pens stay high but are more stable  .", "Best Chart Choices for This Dataset", "Chart Type   What it shows best   Why it is useful here", "Line chart   Month-by-month trend for each product   Best for seeing direction over time, growth patterns, and whether categories rise or flatten", "Grouped bar chart   Direct comparison of product sales within each month   Best for comparing categories side by side in January, February, March, etc.", "Stacked area chart   Total monthly sales plus changing category contribution   Best for showing overall business growth and how each product contributes to the total", "1) Line Chart", "- Put   Month   on the x-axis and units sold on the y-axis.", "- Use one line each for   Notebooks  ,   Pens  , and   Markers  .", "- This chart would show:", "-   Notebooks   rising from 120 to 168, with a small dip in April", "-   Pens   staying consistently strong, mostly around 200–230", "-   Markers   growing steadily from 75 to 111", "2) Grouped Bar Chart", "- For each month, place 3 bars together: Notebooks, Pens, Markers.", "- This chart would show best:", "- Which category sold the most in each month", "- How large the gap is between categories each month", "- That   Pens lead every month  , but   Notebooks are closing some of the distance", "3) Stacked Area Chart", "- Stack the 3 product series across time.", "- This chart would show best:", "- Whether   total monthly sales   are increasing", "- How much each category contributes to the overall business", "- That growth is coming from more than one category, not just a single product line", "Main Business Insights", "-   Total sales are growing steadily overall", "Monthly totals rise from   405   in January to   509   in May, which is an increase of   104 units  .", "-   Notebooks show strong growth", "Sales increase from   120   to   168  : a gain of   48 units   or about   40%  . This suggests rising demand or successful merchandising.", "-   Markers are the fastest-growing category by percentage", "Sales increase from   75   to   111  : a gain of   36 units   or about   48%  . Even though volume is lower than Pens, growth is strong.", "-   Pens remain the top-selling category", "Pens lead every month and rise from   210   to   230  , though the trend is flatter than the other two categories. This looks like a mature, reliable product line.", "-   April to May is especially strong", "All three categories increase from April to May:", "- Notebooks: 142 → 168", "- Pens: 220 → 230", "- Markers: 105 → 111", "This may indicate seasonal demand, a promotion, or stronger traffic.", "-   Small volatility, but no major decline trend", "Notebooks dip slightly in April and Pens dip in February and March, but the overall business trend remains positive.", "Chart-Ready Data Points", "Chart title:   Online Stationery Shop Sales by Month", "X-axis:   Month", "Y-axis:   Units Sold", "If you build visuals, the best order is:", "1.   Line chart   for trend", "2.   Grouped bar chart   for monthly comparison", "3.   Stacked area chart   for total growth story", "Quick Actions", "Create Line Chart", "Build in Excel", "Sources", "- Google Sheets chart tools: < >", "- Microsoft Excel chart guide: < >"], "contract_version": "1.0.0", "exact_values": ["1", "1", "1.11", "1.11", "1.11", "104", "105", "111", "111", "111", "120", "120", "142", "168", "168", "168", "2", "2", "200", "210", "220", "230", "230", "230", "3", "3", "3", "3", "3", "3", "3", "3", "36", "40%", "405", "48", "48%", "5 months", "509", "75", "75"], "expected_role_counts": {"action": 2, "audio": 0, "chart": 1, "code": 0, "console": 0, "email": 0, "formula": 0, "image": 0, "table": 1, "video": 0}, "extractor_version": "1.0.0", "headings": ["Stationery Sales Snapshot", "Best Chart Choices for This Dataset", "1) Line Chart", "2) Grouped Bar Chart", "3) Stacked Area Chart", "Main Business Insights", "Chart-Ready Data Points", "Quick Actions", "Sources"], "inline_code": [], "intent": "information_retrieval", "media": [{"kind": "Icon", "required": true, "url": "https://cdn.jsdelivr.net/npm/bootstrap-icons@1.11.3/icons/graph-up.svg"}, {"kind": "Icon", "required": true, "url": "https://cdn.jsdelivr.net/npm/bootstrap-icons@1.11.3/icons/bar-chart.svg"}, {"kind": "Icon", "required": true, "url": "https://cdn.jsdelivr.net/npm/bootstrap-icons@1.11.3/icons/stack.svg"}], "required_roles": {"action": true, "audio": false, "chart": true, "code": false, "console": false, "email": false, "formula": false, "image": false, "table": true, "video": false}, "source_hash": "e4650f6c5ad294426c476ab5fda6f010226a3240380c5b69446b11703a11e93e", "source_links": [], "tables": [{"headers": ["Chart Type", "What it shows best", "Why it is useful here"], "required": true, "rows": [["Line chart", "Month-by-month trend for each product", "Best for seeing direction over time, growth patterns, and whether categories rise or flatten"], ["Grouped bar chart", "Direct comparison of product sales within each month", "Best for comparing categories side by side in January, February, March, etc."], ["Stacked area chart", "Total monthly sales plus changing category contribution", "Best for showing overall business growth and how each product contributes to the total"]]}]}