{"actions": [{"action_type": "openUrl", "label": "Find local classes", "required": true, "target": "https://www.google.com/search?q=beginner+social+dance+classes+near+me"}, {"action_type": "openUrl", "label": "Find local choirs", "required": true, "target": "https://www.google.com/search?q=community+choir+near+me"}, {"action_type": "openUrl", "label": "Explore DJ basics", "required": true, "target": "https://www.google.com/search?q=beginner+DJ+classes+near+me"}, {"action_type": "openUrl", "label": "Find improv classes", "required": true, "target": "https://www.google.com/search?q=beginner+improv+classes+near+me"}, {"action_type": "openUrl", "label": "Compare local classes", "required": true, "target": "https://www.google.com/search?q=beginner+salsa+bachata+swing+classes+near+me"}, {"action_type": "openUrl", "label": "Check community choirs", "required": true, "target": "https://www.google.com/search?q=adult+community+choir+near+me"}], "code_blocks": [], "content_units": ["Hobby Fit at a Glance", "For your priorities—  fun, community, energizing vibe, full-time-work friendly, and within a $120/month budget  —the strongest overall fit is   social dancing  , with   choir singing   as the best lower-pressure alternative.", "Small context note: costs and time can vary by city, but these ranges are realistic for beginner-level participation in many urban areas.", "Social Hobby Comparison Table", "Hobby   Typical Monthly Cost   Learning Curve   Social Pressure   Introvert-Friendliness   Performance Anxiety   Weekly Time Commitment", "Social dancing     $60–$120     Moderate   Moderate at first, then low   Medium-High   Low-Medium   2–4 hrs", "Improv comedy     $100–$200     Moderate-High   High   Medium-Low   High   3–5 hrs", "Amateur theater     $80–$200     Moderate-High   High   Medium   High   4–8 hrs", "Choir singing     $30–$100     Beginner-Moderate   Low-Medium     High     Low-Medium   2–3 hrs", "Beginner DJing     $80–$250+     Moderate   Low at first   High solo, Medium socially   Medium   3–6 hrs", "Best Matches for Your Lifestyle", "Option 1:   Social dancing     Most energizing mix of movement, community, and low competitiveness   Best all-around fit", "- Usually fits your   $120/month cap   if you do one class series plus 1 social night.", "- Strong built-in community without requiring you to be “funny,” theatrical, or highly technical.", "- Energizing after work because it’s active and social, not screen-based.", "Find local classes", "Option 2:   Choir singing     Warm, structured community with lower social pressure   Best calm-community option", "- Often the   most budget-friendly   and one of the easiest to sustain with a full-time job.", "- You participate as part of a group, so attention is shared rather than focused on you.", "- Great if you want belonging without a highly extroverted atmosphere.", "Find local choirs", "Option 3:   Beginner DJing     Creative and exciting, but less naturally communal at the start   Best solo-to-social path", "- Can be energizing, but gear/software can push you over budget.", "- Early learning is often solitary unless you join a scene or class.", "- Better if you want music-making identity more than instant community.", "Explore DJ basics", "Option 4:   Improv comedy     Fast-bonding and lively, but socially demanding   Best if you want boldness training", "- Often excellent for community, but can feel high-pressure for beginners.", "- More emotionally exposing than dancing or choir.", "- Good fit only if “pushing comfort zone” is a major goal.", "Find improv classes", "Recommendation for a 32-Year-Old Beginner", "Pick social dancing first.", "Why it best matches your constraints:", "-   Budget:   realistic within   $120/month", "-   Work schedule:   manageable at   2–4 hours/week", "-   Energy:   physical, upbeat, and mood-lifting after work", "-   Community:   easy repeated contact with people without requiring deep instant vulnerability", "-   Non-competitive feel:   most beginner social dance spaces are built around participation, not winning", "Best dance styles for your goals:", "-   Salsa or bachata   if you want lively, social, and welcoming", "-   Swing/Lindy Hop   if you want playful community energy", "-   West Coast Swing   if you want a modern, flexible social scene", "If you want the gentlest entry point instead, choose   choir singing  .", "Why the Others Rank Lower", "-   Improv comedy:   highly energizing, but the combination of cost, social exposure, and performance anxiety makes it a tougher first hobby after full-time work.", "-   Amateur theater:   strongest community immersion, but usually the   highest time commitment   and the most performance-heavy.", "-   Beginner DJing:   can be exciting, but it’s often less immediately communal and more gear-dependent than it first appears.", "Quick Actions", "Compare local classes", "Check community choirs", "Sources", "- Community education listings reference point: < >", "- Dance organization/class discovery reference point: < >", "- Choir discovery reference point: < >"], "contract_version": "1.0.0", "exact_values": ["$100", "$100", "$120", "$120", "$120", "$120", "$200", "$200", "$250", "$30", "$60", "$80", "$80", "1", "1", "1.11", "1.11", "1.11", "1.11", "2", "2", "2", "2", "3", "3", "3", "3", "3", "3", "3", "3 hrs", "32", "4", "4", "4 hours", "4 hrs", "5 hrs", "6 hrs", "8 hrs"], "expected_role_counts": {"action": 9, "audio": 0, "chart": 0, "code": 0, "console": 0, "email": 0, "formula": 0, "image": 0, "table": 1, "video": 0}, "extractor_version": "1.0.0", "headings": ["Hobby Fit at a Glance", "Social Hobby Comparison Table", "Best Matches for Your Lifestyle", "Recommendation for a 32-Year-Old Beginner", "Why the Others Rank Lower", "Quick Actions", "Sources"], "inline_code": [], "intent": "entertainment", "media": [{"kind": "Icon", "required": true, "url": "https://cdn.jsdelivr.net/npm/bootstrap-icons@1.11.3/icons/music-note-beamed.svg"}, {"kind": "Icon", "required": true, "url": "https://cdn.jsdelivr.net/npm/bootstrap-icons@1.11.3/icons/music-note.svg"}, {"kind": "Icon", "required": true, "url": "https://cdn.jsdelivr.net/npm/bootstrap-icons@1.11.3/icons/play-circle.svg"}, {"kind": "Icon", "required": true, "url": "https://cdn.jsdelivr.net/npm/bootstrap-icons@1.11.3/icons/star.svg"}], "required_roles": {"action": true, "audio": false, "chart": false, "code": false, "console": false, "email": false, "formula": false, "image": false, "table": true, "video": false}, "source_hash": "6cfe8f676d258b8e2330a61fda1cd1e0a3667948f6735ebc3327d0f61f77fcc1", "source_links": [{"url": "https://www.danceus.org/"}, {"url": "https://www.eventbrite.com/"}, {"url": "https://www.singers.com/"}], "tables": [{"headers": ["Hobby", "Typical Monthly Cost", "Learning Curve", "Social Pressure", "Introvert-Friendliness", "Performance Anxiety", "Weekly Time Commitment"], "required": true, "rows": [["Social dancing", "$60–$120", "Moderate", "Moderate at first, then low", "Medium-High", "Low-Medium", "2–4 hrs"], ["Improv comedy", "$100–$200", "Moderate-High", "High", "Medium-Low", "High", "3–5 hrs"], ["Amateur theater", "$80–$200", "Moderate-High", "High", "Medium", "High", "4–8 hrs"], ["Choir singing", "$30–$100", "Beginner-Moderate", "Low-Medium", "High", "Low-Medium", "2–3 hrs"], ["Beginner DJing", "$80–$250+", "Moderate", "Low at first", "High solo, Medium socially", "Medium", "3–6 hrs"]]}]}